{
  "transformationId": "tx-exmc-0001",
  "timestamp": "2027-03-18T16:22:00Z",
  "source": {
    "sysmlProjectId": "medical-system-foundation",
    "sysmlCommitId": "sysml-8df65f0d",
    "elementIds": [
      "action-perform-ultrasound",
      "attr-doppler-velocity",
      "attr-heart-rate",
      "part-def-exmc-ultrasound",
      "part-usage-exmc-us-01",
      "port-medical-data",
      "req-med-042",
      "req-telemetry-014"
    ]
  },
  "target": {
    "fhirPackage": "org.example.exmc#0.4.0",
    "resources": [
      "ActivityDefinition/perform-ultrasound-exam",
      "Device/ultrasound-unit01",
      "DeviceDefinition/exmc-ultrasound-type",
      "DeviceMetric/doppler-velocity-capability",
      "DeviceMetric/heart-rate-metric-capability",
      "Observation/doppler-velocity-example",
      "Observation/heart-rate-metric-example"
    ]
  },
  "ruleset": {
    "id": "exmc-mappings",
    "version": "1.8.2"
  },
  "generator": {
    "name": "sysml-fhir-bridge",
    "version": "0.1.0",
    "buildDigest": "sha256:3ffc11f7f9ad65ea466e93ef837eb5fa67618419ef6aec78f383fca05ccbda03"
  },
  "artifacts": [
    {
      "name": "fhir/devicedefinition-exmc-ultrasound-type.json",
      "sha256": "62faf848a0e602af7bbe51784eb192e8103d90b67f5fda72c54d50ff416a9c05"
    },
    {
      "name": "fhir/device-ultrasound-unit01.json",
      "sha256": "518fdc41890b256e0182e6b2aa7db9db2be77e941e9130a90d754ed88082a7fc"
    },
    {
      "name": "fhir/devicemetric-heart-rate-metric-capability.json",
      "sha256": "a5fb224d17af01b1d0f67401a9cca70250583834573eccfb4a35fc0d8cd3ca1a"
    },
    {
      "name": "fhir/observation-heart-rate-metric-example.json",
      "sha256": "22df30cc4fc99026e0f83e39e66dff2f977d9805f0bb000832d0c26953cd5947"
    },
    {
      "name": "fhir/devicemetric-doppler-velocity-capability.json",
      "sha256": "915731da15abd1cb04f16646d7fbc9b5ddc59f0b4accb20c229a33be7b42cc4a"
    },
    {
      "name": "fhir/observation-doppler-velocity-example.json",
      "sha256": "847e05d8a855e2766b09cab56bd3e21dfcc5aa6c8406e2accef03e3e3c4942ca"
    },
    {
      "name": "fhir/activitydefinition-perform-ultrasound-exam.json",
      "sha256": "3cec8f1a76689cd6fe411cf5529fcdae44edb8bca533c9f795dacb2ded8583c6"
    },
    {
      "name": "exmc-medical-icd.md",
      "sha256": "241f693af067887f5f85766ff7a3cd52ba8a008d51967f339109585850ff3ab7"
    },
    {
      "name": "exmc-medical-icd.html",
      "sha256": "7b340012e8c0d3e7b3fddac553c39f218b972c12c3775ec73be7cb80a6094fa1"
    },
    {
      "name": "verification-matrix.md",
      "sha256": "e44e3b13b12559d2645f69021983921f308f887300e7650e83b956aa503f229d"
    },
    {
      "name": "diagrams/requirements-trace.mmd",
      "sha256": "1f9b113be85f8c8b4b311ba2491b0aba74b988288429eeea882988531d200fa2"
    },
    {
      "name": "diagrams/requirements-trace.svg",
      "sha256": "b674157fc0c1e2968261ddc138a6c154661544efb5edfe6240bee7e8cc5589d7"
    },
    {
      "name": "diagrams/requirements-trace.puml",
      "sha256": "7040c03791f11a801363b5674d43e7af7a4bb4665dc977e723a997f1001d754b"
    },
    {
      "name": "diagrams/architecture.mmd",
      "sha256": "2e3d4208b29ba0f102e9be645ecd58af45f3ad5e64c856f1bdac2c0f5a824d6d"
    },
    {
      "name": "diagrams/architecture.svg",
      "sha256": "1fac6476784284461ec348f946d2716250b48cc27a3849ecf75365229f207407"
    },
    {
      "name": "diagrams/architecture.puml",
      "sha256": "dc291148a9ccec0556e4b63c5e815c5fbe0160e3307b785d34013cf64cd57633"
    },
    {
      "name": "impact-report.json",
      "sha256": "7c8493d877a0f9e09c6cce6f975c29dbb8f60e421f2497d428b60fa311a08c91"
    },
    {
      "name": "change-proposals.json",
      "sha256": "d49b096b76c905845df78d5586f011ca8c72ba4c9c5095913a11f79c45272f7d"
    },
    {
      "name": "conformance-report.json",
      "sha256": "a47e02df91d937d77d4c839c726c9cf4a5ddb6f021adcc8bcc53d60921236643"
    },
    {
      "name": "conformance-report.html",
      "sha256": "a7ddd05624c02c88022a7ceb37bc05576618287d75cfc70e6b60035232361cb3"
    },
    {
      "name": "fhir/bundle-trace-projection.json",
      "sha256": "a09b1c1eca1ecbc23caca964279edf19cf0c02dcbe6fb837d03ea94301cb7187"
    },
    {
      "name": "trace-explorer.html",
      "sha256": "7ccbbb9b10832f7c9aab8c1db6d2481ff867f1dd7d56cd69b8a2c96ddbe0f49b"
    },
    {
      "name": "trace-links.json",
      "sha256": "6fa3b442fe9376054a08fc88dd927669a5cc45d1c7d050381cc49710540fb510"
    }
  ]
}
